{
  "$schema": "https://json-schema.org/draft/2020-12/schema",
  "$id": "https://solidprivacy.nl/schemas/dpia_analysis_result.schema.json",
  "title": "SolidPrivacy Structured DPIA Analysis Result",
  "type": "object",
  "required": ["request_id", "provider", "model", "sections", "claims", "risks", "measures", "assumptions", "open_questions", "residual_risk_status", "validation_status", "human_review_required", "model_metadata"],
  "properties": {
    "request_id": {"type": "string"},
    "provider": {"type": "string"},
    "model": {"type": "string"},
    "sections": {"type": "array", "items": {"$ref": "#/$defs/section"}, "minItems": 1},
    "claims": {"type": "array", "items": {"$ref": "#/$defs/supportedClaim"}},
    "risks": {"type": "array", "items": {"$ref": "#/$defs/candidateRisk"}},
    "measures": {"type": "array", "items": {"$ref": "#/$defs/candidateMeasure"}},
    "assumptions": {"type": "array", "items": {"type": "string"}},
    "open_questions": {"type": "array", "items": {"type": "string"}},
    "residual_risk_status": {"const": "requires_human_assessment"},
    "validation_status": {"type": "string", "enum": ["unvalidated", "traceability_validated", "challenged"]},
    "human_review_required": {"const": true},
    "validator_notes": {"type": "array", "items": {"type": "string"}},
    "model_metadata": {
      "type": "object",
      "required": ["prompt_version"],
      "properties": {
        "prompt_version": {"type": "string"},
        "response_id": {"type": ["string", "null"]},
        "raw_output_hash": {"type": ["string", "null"]}
      },
      "additionalProperties": false
    }
  },
  "$defs": {
    "section": {
      "type": "object",
      "required": ["id", "title", "narrative", "fact_ids", "legal_rule_ids", "claim_ids", "unresolved_fact_ids"],
      "properties": {
        "id": {"type": "string"},
        "title": {"type": "string"},
        "narrative": {"type": "string", "minLength": 1},
        "fact_ids": {"type": "array", "items": {"type": "string"}, "uniqueItems": true},
        "legal_rule_ids": {"type": "array", "items": {"type": "string"}, "uniqueItems": true},
        "claim_ids": {"type": "array", "items": {"type": "string"}, "uniqueItems": true},
        "unresolved_fact_ids": {"type": "array", "items": {"type": "string"}, "uniqueItems": true}
      },
      "additionalProperties": false
    },
    "supportedClaim": {
      "type": "object",
      "required": ["id", "claim", "rule_ids", "fact_ids"],
      "properties": {
        "id": {"type": "string"},
        "claim": {"$ref": "legal_claim.schema.json"},
        "rule_ids": {"type": "array", "items": {"type": "string"}, "minItems": 1, "uniqueItems": true},
        "fact_ids": {"type": "array", "items": {"type": "string"}, "uniqueItems": true}
      },
      "additionalProperties": false
    },
    "candidateRisk": {
      "type": "object",
      "required": ["id", "description", "fact_ids", "legal_rule_ids", "likelihood", "impact", "inherent_level", "rationale"],
      "properties": {
        "id": {"type": "string"},
        "description": {"type": "string"},
        "fact_ids": {"type": "array", "items": {"type": "string"}, "minItems": 1, "uniqueItems": true},
        "legal_rule_ids": {"type": "array", "items": {"type": "string"}, "uniqueItems": true},
        "likelihood": {"type": "string", "enum": ["low", "medium", "high", "unknown"]},
        "impact": {"type": "string", "enum": ["low", "medium", "high", "unknown"]},
        "inherent_level": {"type": "string", "enum": ["low", "medium", "high", "unknown"]},
        "rationale": {"type": "string"}
      },
      "additionalProperties": false
    },
    "candidateMeasure": {
      "type": "object",
      "required": ["id", "description", "risk_ids", "measure_types", "rationale"],
      "properties": {
        "id": {"type": "string"},
        "description": {"type": "string"},
        "risk_ids": {"type": "array", "items": {"type": "string"}, "minItems": 1, "uniqueItems": true},
        "measure_types": {"type": "array", "items": {"type": "string", "enum": ["technical", "organisational", "legal"]}, "minItems": 1, "uniqueItems": true},
        "rationale": {"type": "string"}
      },
      "additionalProperties": false
    }
  },
  "additionalProperties": false
}
