{"request_id":"DPIA-AN-REQ-001","provider":"fixture","model":"fixture-dpia-analyst-v1","sections":[{"id":"SEC-001","title":"Verwerking en doel","narrative":"De beschikbare evidence beschrijft een intern medewerkersportaal voor zakelijke profielgegevens en accountbeheer.","fact_ids":["F-FX-001"],"legal_rule_ids":["gdpr-art35-7-minimum-content"],"claim_ids":["CL-001"],"unresolved_fact_ids":["F-FX-001"]},{"id":"SEC-002","title":"FG-advies en risicobeoordeling","narrative":"De DPIA moet de vereiste onderdelen bevatten; waar een FG is aangewezen moet diens advies worden gevraagd. EDPB-criteria zijn guidance voor het beoordelen van waarschijnlijk hoog risico.","fact_ids":["F-FX-001","F-FX-002"],"legal_rule_ids":["gdpr-art35-2-dpo-advice","edpb-wp248-two-criteria"],"claim_ids":["CL-002","CL-003"],"unresolved_fact_ids":["F-FX-001","F-FX-002"]}],"claims":[{"id":"CL-001","claim":{"claim":"Een DPIA moet ten minste de beoogde verwerking en doeleinden, noodzaak en evenredigheid, risico's en voorgenomen maatregelen behandelen.","classification":"LAW_REQUIRED","jurisdiction":"EU/EEA","authority":"European Union","source_id":"eu-gdpr-eurlex","citation":"Article 35(7)(a)-(d)","effective_date":null,"verified_at":"2026-08-10T23:30:00+02:00","supersedes":null,"notes":null},"rule_ids":["gdpr-art35-7-minimum-content"],"fact_ids":["F-FX-001"]},{"id":"CL-002","claim":{"claim":"Wanneer een functionaris voor gegevensbescherming is aangewezen, moet de verwerkingsverantwoordelijke diens advies vragen bij het uitvoeren van de DPIA.","classification":"LAW_REQUIRED","jurisdiction":"EU/EEA","authority":"European Union","source_id":"eu-gdpr-eurlex","citation":"Article 35(2)","effective_date":null,"verified_at":"2026-08-10T23:30:00+02:00","supersedes":null,"notes":null},"rule_ids":["gdpr-art35-2-dpo-advice"],"fact_ids":[]},{"id":"CL-003","claim":{"claim":"Volgens EDPB-guidance is het voldoen aan twee high-risk criteria in de meeste gevallen een sterke aanwijzing om een DPIA uit te voeren, terwijl één criterium afhankelijk van de context voldoende kan zijn.","classification":"REGULATOR_GUIDANCE","jurisdiction":"EU/EEA","authority":"European Data Protection Board / Article 29 Working Party","source_id":"edpb-dpia-guidelines-wp248","citation":"WP248 rev.01 high-risk criteria","effective_date":null,"verified_at":"2026-08-10T23:30:00+02:00","supersedes":null,"notes":null},"rule_ids":["edpb-wp248-two-criteria"],"fact_ids":[]}],"risks":[{"id":"R-DRAFT-001","description":"Onbevoegde toegang tot medewerkersprofielen kan de vertrouwelijkheid van persoonsgegevens aantasten.","fact_ids":["F-FX-001"],"legal_rule_ids":["gdpr-art35-7-minimum-content"],"likelihood":"unknown","impact":"medium","inherent_level":"unknown","rationale":"De beschikbare evidence beschrijft de verwerking, maar bevat nog onvoldoende technische gegevens om de kans betrouwbaar te bepalen."}],"measures":[{"id":"M-DRAFT-001","description":"Onderzoek en documenteer passende toegangsbeperkingen en periodieke autorisatiereviews.","risk_ids":["R-DRAFT-001"],"measure_types":["technical","organisational"],"rationale":"De maatregel is een kandidaat; geschiktheid en implementatiebewijs moeten nog door de organisatie en Privacy Officer worden vastgesteld."}],"assumptions":[],"open_questions":["Welke concrete autorisatie- en loggingmaatregelen zijn geïmplementeerd?","Is een functionaris voor gegevensbescherming aangewezen voor deze organisatie?"],"residual_risk_status":"requires_human_assessment","validation_status":"unvalidated","human_review_required":true,"validator_notes":[],"model_metadata":{"prompt_version":"draft-dpia-v1","response_id":"fixture-dpia-response-001","raw_output_hash":"synthetic:dpia-result1"}}